sample_id,repo,commit_hash,file_path,entity_type,entity_name,entity_signature,javadoc_change_type,method_change_type,issue_id,issue_summary
sample_0001,JodaOrg/joda-time,0e251d278604252a9986f2338c1cee56a9e052a2,src/main/java/org/joda/time/DateTimeZone.java,method,forID,@FromString public static DateTimeZone forID(String id),JAVADOC_MODIFICATION,METHOD_MODIFICATION,#733,Match more time-zone IDs
sample_0002,JodaOrg/joda-time,ed9d0a2f5928433ac3d3883d317e996f9e94c9b1,src/main/java/org/joda/time/DateTimeZone.java,method,getDefault,public static DateTimeZone getDefault(),JAVADOC_MODIFICATION,METHOD_MODIFICATION,#587,Introduce new system property for timezones
sample_0003,JodaOrg/joda-time,48b6ae85b02f41bec0fac7110ee47239c53eee9d,src/main/java/org/joda/time/DateTime.java,method,withDate,"public DateTime withDate(int year, int monthOfYear, int dayOfMonth)",JAVADOC_MODIFICATION,METHOD_MODIFICATION,#233,Fix DateTime.withDate() DateTime.withTime()
sample_0004,JodaOrg/joda-time,48b6ae85b02f41bec0fac7110ee47239c53eee9d,src/main/java/org/joda/time/DateTime.java,method,withTime,"public DateTime withTime(int hourOfDay, int minuteOfHour, int secondOfMinute, int millisOfSecond)",JAVADOC_MODIFICATION,METHOD_MODIFICATION,#233,Fix DateTime.withDate() DateTime.withTime()
sample_0005,JodaOrg/joda-time,ca8f807b99b16ce5cc51444ce17ca12abdc7ff80,src/main/java/org/joda/time/DateTimeZone.java,method,getDefaultProvider,private static Provider getDefaultProvider(),JAVADOC_MODIFICATION,METHOD_MODIFICATION,#37,Added new system property for time-zone loading
sample_0006,JodaOrg/joda-time,19546b6960c41dcd053bd06e7345bd015946809c,src/main/java/org/joda/time/LocalDate.java,method,toDateTime,"public DateTime toDateTime(LocalTime time, DateTimeZone zone)",JAVADOC_MODIFICATION,METHOD_MODIFICATION,#177,Alter LocalDate.toDateTime to be more consistent
sample_0007,JodaOrg/joda-time,6762d7919e99c741c66f0a22f0d1175d3e631c86,src/main/java/org/joda/time/format/PeriodFormat.java,method,wordBased,public static PeriodFormatter wordBased(Locale locale),JAVADOC_MODIFICATION,METHOD_MODIFICATION,,Add regular expression based localization to PeriodFormatterBuilder and PeriodFormat. Add Polish locale to PeriodFormat. Add tests.
sample_0008,JodaOrg/joda-time,ec4c7b5fe0d7e52ccd43090bf2f8eb651f74b5db,src/main/java/org/joda/time/Partial.java,method,Partial,"public Partial(DateTimeFieldType[] types, int[] values, Chronology chronology)",JAVADOC_MODIFICATION,METHOD_MODIFICATION,#96,Avoid creating Partials with order weekyear-year
sample_0009,JodaOrg/joda-time,362ed1787724cda3ded37de2b0aa0f13adf0a66e,src/main/java/org/joda/time/DateTimeZone.java,method,forOffsetHoursMinutes,"public static DateTimeZone forOffsetHoursMinutes(int hoursOffset, int minutesOffset) throws IllegalArgumentException",JAVADOC_MODIFICATION,METHOD_MODIFICATION,#42,Fix to allow offsets from -00:01 to -00:59
sample_0010,JodaOrg/joda-time,cd24d5cb2a981ed5af3a3060399a13e010c33a6f,src/main/java/org/joda/time/MutableDateTime.java,method,setDate,public void setDate(final ReadableInstant instant),JAVADOC_MODIFICATION,METHOD_MODIFICATION,,Fix to handle cross-time-zone issues properly rather than always using UTC
sample_0011,JodaOrg/joda-time,1ec3c2f0962d41db0d83e01ac5df26d7b954aa34,src/main/java/org/joda/time/format/DateTimeParserBucket.java,method,getOffset,@Deprecated public int getOffset(),JAVADOC_MODIFICATION,METHOD_MODIFICATION,,Support parsing of date-time zone names like BST or British Summer Time
sample_0012,JodaOrg/joda-time,53eadfbd0ec9d6b4a02dae38730b77b14000c1f3,src/main/java/org/joda/time/format/DateTimeParserBucket.java,method,setZone,public void setZone(DateTimeZone zone),JAVADOC_MODIFICATION,METHOD_MODIFICATION,,Support parsing of date-time zone IDs like Europe/London
sample_0013,JodaOrg/joda-time,e6cd9ba1f1c2a846c6b588668d6896123f290f91,src/main/java/org/joda/time/ReadablePartial.java,class,ReadablePartial,public interface ReadablePartial extends Comparable<ReadablePartial>,JAVADOC_MODIFICATION,METHOD_MODIFICATION,,Rely on interface rather than redeclaration when adding Comparable to ReadablePartial interface for better backwards compatibility
sample_0014,JodaOrg/joda-time,843d7b8f07f4899ad153ffabc25e09a6c0e897c7,JodaTime/src/main/java/org/joda/time/format/DateTimeParserBucket.java,method,DateTimeParserBucket,"@Deprecated public DateTimeParserBucket(long instantLocal, Chronology chrono, Locale locale, Integer pivotYear)",JAVADOC_MODIFICATION,METHOD_MODIFICATION,,Parse month-day in year 2000 instead of 1970 to parse Feb 29
sample_0015,JodaOrg/joda-time,b835259ecb3d91234a5ff36e57bb928cadc4aa36,JodaTime/src/main/java/org/joda/time/DateTimeZone.java,method,getDefault,public static DateTimeZone getDefault(),JAVADOC_MODIFICATION,METHOD_MODIFICATION,,Document algorithm for default time-zone
sample_0016,JodaOrg/joda-time,1129d94626ddab75f7b24755106639d8024beb7e,JodaTime/src/main/java/org/joda/time/ReadableDuration.java,class,ReadableDuration,public interface ReadableDuration extends Comparable<ReadableDuration>,JAVADOC_MODIFICATION,METHOD_MODIFICATION,,Fix generics implementation to retain binary compatibility
sample_0017,JodaOrg/joda-time,1129d94626ddab75f7b24755106639d8024beb7e,JodaTime/src/main/java/org/joda/time/ReadableInstant.java,class,ReadableInstant,public interface ReadableInstant extends Comparable<ReadableInstant>,JAVADOC_MODIFICATION,METHOD_MODIFICATION,,Fix generics implementation to retain binary compatibility
sample_0018,JodaOrg/joda-time,0109c4334e4a1abe4c6e396560b4eaafd72ecef6,JodaTime/src/main/java/org/joda/time/format/PeriodFormat.java,method,getDefault,public static PeriodFormatter getDefault(),JAVADOC_MODIFICATION,METHOD_MODIFICATION,,Add multi-language word-based period formatting [1252708 based on idea and code from Ricardo Trindade
sample_0019,JodaOrg/joda-time,70d6a2e603ff58af6c37b2ac7d31663893a0ced9,JodaTimeContrib/hibernate/src/java/org/joda/time/contrib/hibernate/PersistentInstant.java,class,PersistentInstant,public class PersistentInstant implements EnhancedUserType,JAVADOC_MODIFICATION,METHOD_MODIFICATION,,Add Instant persistance by BIGINT and TIMESTAMP
sample_0020,JodaOrg/joda-time,a3cc13c9ce9a47b656823a4836a4f89fea34fb18,JodaTime/src/java/org/joda/time/LocalDate.java,method,toInterval,public Interval toInterval(DateTimeZone zone),JAVADOC_MODIFICATION,METHOD_MODIFICATION,,Fix DST cutover issues for LocalDate.toInterval() [2487417 Raised by Luc Claes
sample_0021,JodaOrg/joda-time,1b5988e323078979f1a2af075c925e3d668ecefe,JodaTime/src/java/org/joda/time/format/ISODateTimeFormat.java,method,forFields,"public static DateTimeFormatter forFields( Collection fields, boolean extended, boolean strictISO)",JAVADOC_MODIFICATION,METHOD_MODIFICATION,,DateTimeFormat.forFields(List) method can't handle immutable [1877843
sample_0022,JodaOrg/joda-time,b58f412c748568b12f07f58edc0773c279408490,JodaTimeContrib/hibernate/src/java/org/joda/time/contrib/hibernate/PersistentDuration.java,class,PersistentDuration,public class PersistentDuration extends AbstractStringBasedJodaType,JAVADOC_MODIFICATION,METHOD_MODIFICATION,,Store period and duration using ISO8601 string
sample_0023,JodaOrg/joda-time,b58f412c748568b12f07f58edc0773c279408490,JodaTimeContrib/hibernate/src/java/org/joda/time/contrib/hibernate/PersistentPeriod.java,class,PersistentPeriod,public class PersistentPeriod extends AbstractStringBasedJodaType,JAVADOC_MODIFICATION,METHOD_MODIFICATION,,Store period and duration using ISO8601 string
sample_0024,JodaOrg/joda-time,7755b343d88276ba1a058e14645039daf4642ab2,JodaTime/src/java/org/joda/time/field/LenientDateTimeField.java,method,set,"public long set(long instant, int value)",JAVADOC_MODIFICATION,METHOD_MODIFICATION,,Fix and test LenientChronology to ensure it works with time zones bug 1755161
sample_0025,JodaOrg/joda-time,5dd55066f00e02606e562f257469bc646cdcaba9,JodaTime/src/java/org/joda/time/format/PeriodFormatterBuilder.java,method,toPrinter,public PeriodPrinter toPrinter(),JAVADOC_MODIFICATION,METHOD_MODIFICATION,,"Add PeriodFormatBuilder.append(PeriodPrinter,PeriodParser)"
sample_0026,JodaOrg/joda-time,5dd55066f00e02606e562f257469bc646cdcaba9,JodaTime/src/java/org/joda/time/format/PeriodFormatterBuilder.java,method,toParser,public PeriodParser toParser(),JAVADOC_MODIFICATION,METHOD_MODIFICATION,,"Add PeriodFormatBuilder.append(PeriodPrinter,PeriodParser)"
sample_0027,JodaOrg/joda-time,1710dc4fb6974e6d9e37752f2572f625ce79a52d,JodaTime/src/java/org/joda/time/convert/StringConverter.java,method,getPartialValues,"public int[] getPartialValues(ReadablePartial fieldSource, Object object, Chronology chrono, DateTimeFormatter parser)",JAVADOC_MODIFICATION,METHOD_MODIFICATION,,Test and fix local string parsing
sample_0028,JodaOrg/joda-time,1710dc4fb6974e6d9e37752f2572f625ce79a52d,JodaTime/src/java/org/joda/time/format/ISODateTimeFormat.java,method,localTimeParser,public static DateTimeFormatter localTimeParser(),JAVADOC_MODIFICATION,METHOD_MODIFICATION,,Test and fix local string parsing
sample_0029,JodaOrg/joda-time,a01f36f8431f42d8d1dad2d67e256e37f73027eb,JodaTime/src/java/org/joda/time/base/AbstractInterval.java,method,overlaps,public boolean overlaps(ReadableInterval interval),JAVADOC_MODIFICATION,METHOD_MODIFICATION,,"Reset interval behaviour back to v1.2, except fixing a bug in overlaps() when passing in null"
sample_0030,JodaOrg/joda-time,bf8d08e230c5d1f18fc439a8caeb7bbd8f971e66,JodaTime/src/java/org/joda/time/base/AbstractInterval.java,method,contains,public boolean contains(ReadableInterval interval),JAVADOC_MODIFICATION,METHOD_MODIFICATION,,Tighten interval specification wrt zero duration intervals Change a zero duration interval to contains() itself and an instant of the same value
sample_0031,JodaOrg/joda-time,f8d725139f782c230cf8db925086bb6838e1327f,JodaTime/src/java/org/joda/time/format/ISODateTimeFormat.java,method,dateTimeParser,public static DateTimeFormatter dateTimeParser(),JAVADOC_MODIFICATION,METHOD_MODIFICATION,,Add and use new local ISO parsers
sample_0032,JodaOrg/joda-time,84f9e8210f6a63e7ec63684432e0f2946f206b18,JodaTime/src/java/org/joda/time/YearMonthDay.java,method,YearMonthDay,public YearMonthDay(Object instant),JAVADOC_MODIFICATION,METHOD_MODIFICATION,,Prevent String constructor from accepting times only
sample_0033,JodaOrg/joda-time,63c9445d31a750687957d97fed1150f8fe7944cb,JodaTime/src/java/org/joda/time/LocalDate.java,method,withPeriodAdded,"public LocalDate withPeriodAdded(ReadablePeriod period, int scalar)",JAVADOC_MODIFICATION,METHOD_MODIFICATION,,Start testing LocalDate
sample_0034,JodaOrg/joda-time,621b83eafe8dcddf5c1b108c41051b5917efbbd9,JodaTime/src/java/org/joda/time/LocalTime.java,method,withHourOfDay,public LocalTime withHourOfDay(int hour),JAVADOC_MODIFICATION,METHOD_MODIFICATION,,Test LocalTime
sample_0035,JodaOrg/joda-time,621b83eafe8dcddf5c1b108c41051b5917efbbd9,JodaTime/src/java/org/joda/time/LocalTime.java,method,withMinuteOfHour,public LocalTime withMinuteOfHour(int minute),JAVADOC_MODIFICATION,METHOD_MODIFICATION,,Test LocalTime
sample_0036,JodaOrg/joda-time,621b83eafe8dcddf5c1b108c41051b5917efbbd9,JodaTime/src/java/org/joda/time/LocalTime.java,method,withSecondOfMinute,public LocalTime withSecondOfMinute(int second),JAVADOC_MODIFICATION,METHOD_MODIFICATION,,Test LocalTime
sample_0037,JodaOrg/joda-time,ee0a30f6db2d9d1b0b34294990f7f6a01e6352c1,JodaTime/src/java/org/joda/time/DateTimeUtils.java,method,toGregorianCalendar,public static GregorianCalendar toGregorianCalendar(ReadableInstant instant),JAVADOC_MODIFICATION,METHOD_MODIFICATION,,Add methods to handle time zone differences
sample_0038,JodaOrg/joda-time,6f9ef4c4033655457d3809e6785d45605051d466,JodaTime/src/java/org/joda/time/Interval.java,method,overlap,public Interval overlap(ReadableInterval interval),JAVADOC_MODIFICATION,METHOD_MODIFICATION,,Interval Added gap method that returns the gap between two intervals. Added abuts method that returns true if two intervals abut. DateTimeUtils Added getReadableInterval(ReadableInterval) method to handle null intervals
sample_0039,JodaOrg/joda-time,65a5478fb4d8616417524d13954fe92c501f9e69,JodaTime/src/java/org/joda/time/base/BasePeriod.java,method,BasePeriod,"protected BasePeriod(ReadablePartial start, ReadablePartial end, PeriodType type)",JAVADOC_MODIFICATION,METHOD_MODIFICATION,,Ensure that Period constructors for partials check for contiguous partials
sample_0040,JodaOrg/joda-time,b83fb175ebcab3a7176c49fb7c97d4863a4049a2,JodaTime/src/java/org/joda/time/Partial.java,class,Partial,"public final class Partial extends AbstractPartial implements ReadablePartial, Serializable",JAVADOC_MODIFICATION,METHOD_MODIFICATION,,Add isMatch() method to Partial
sample_0041,JodaOrg/joda-time,17eb41943b7289bb9607e0f840076b61a3e3c707,JodaTime/src/java/org/joda/time/format/ISODateTimeFormat.java,class,ISODateTimeFormat,public class ISODateTimeFormat,JAVADOC_MODIFICATION,METHOD_MODIFICATION,,Add ISODateTimeFormat.forFields to get a suitable format for a subset of datetime fields
sample_0042,JodaOrg/joda-time,61c64930304b87d4aa81dca05aba09591b3b2d52,JodaTime/src/java/org/joda/time/TimeOfDay.java,method,withChronologyRetainFields,public TimeOfDay withChronologyRetainFields(Chronology newChronology),JAVADOC_MODIFICATION,METHOD_MODIFICATION,,Fix bug in withChronologyRetainFields because no validation occurred
sample_0043,JodaOrg/joda-time,8a58750637798ab015fa79019e935c89acdf00fa,JodaTime/src/java/org/joda/time/DateTimeZone.java,method,getInstance,public static DateTimeZone getInstance(String id),JAVADOC_MODIFICATION,METHOD_MODIFICATION,,Change DateTimeZone to use forXxx factory methods
sample_0044,JodaOrg/joda-time,043abebe138fcbacd6448c1664b0eab1e15184e8,JodaTime/src/java/org/joda/time/chrono/BuddhistChronology.java,class,BuddhistChronology,public final class BuddhistChronology extends AssembledChronology,JAVADOC_MODIFICATION,METHOD_MODIFICATION,,Test and fix bugs in Buddhist Chronology
sample_0045,JodaOrg/joda-time,129288e632957675d95c32bbb019964ce2899529,JodaTime/src/java/org/joda/time/field/AbstractReadableInstantFieldProperty.java,method,compareTo,public int compareTo(ReadablePartial partial),JAVADOC_MODIFICATION,METHOD_MODIFICATION,,Switch from getReadableInstant to protected getMillis in Property
sample_0046,JodaOrg/joda-time,1707517294d44202e104305e7b0c6fb12dd1a6dd,JodaTime/src/java/org/joda/time/format/DateTimeFormatterBuilder.java,method,append,public DateTimeFormatterBuilder append(DateTimeFormatter formatter),JAVADOC_MODIFICATION,METHOD_MODIFICATION,,Restored formatting interfaces to provide same functionality as v0.95.
sample_0047,JodaOrg/joda-time,6892714b99ed388c1f9f8f55f114fcb602186fa6,JodaTime/src/java/org/joda/time/Chronology.java,method,getDateTimeMillis,"public abstract long getDateTimeMillis(int year, int monthOfYear, int dayOfMonth, int millisOfDay)",JAVADOC_MODIFICATION,METHOD_MODIFICATION,,Checkstyle fixes
sample_0048,JodaOrg/joda-time,56f9a22e1c54ed9316718a367b0f9de017857332,JodaTime/src/java/org/joda/time/format/ISODateTimeFormat.java,method,weekDateTime,public DateTimeFormatter weekDateTime(),JAVADOC_MODIFICATION,METHOD_MODIFICATION,,"Add noMillis methods, javadoc and fix bugs"
sample_0049,JodaOrg/joda-time,56f9a22e1c54ed9316718a367b0f9de017857332,JodaTime/src/java/org/joda/time/format/ISODateTimeFormat.java,method,basicTime,public DateTimeFormatter basicTime(),JAVADOC_MODIFICATION,METHOD_MODIFICATION,,"Add noMillis methods, javadoc and fix bugs"
sample_0050,JodaOrg/joda-time,6a5b8bd64e0cc18555c4cfe791f853278e3f24e7,JodaTime/src/java/org/joda/time/DateMidnight.java,method,withField,"public DateMidnight withField(DateTimeFieldType fieldType, int value)",JAVADOC_MODIFICATION,METHOD_MODIFICATION,,Increase test coverage
sample_0051,JodaOrg/joda-time,6a5b8bd64e0cc18555c4cfe791f853278e3f24e7,JodaTime/src/java/org/joda/time/DateMidnight.java,method,withFieldAdded,"public DateMidnight withFieldAdded(DurationFieldType fieldType, int amount)",JAVADOC_MODIFICATION,METHOD_MODIFICATION,,Increase test coverage
sample_0052,JodaOrg/joda-time,6a5b8bd64e0cc18555c4cfe791f853278e3f24e7,JodaTime/src/java/org/joda/time/MutableDateTime.java,method,set,"public void set(DateTimeFieldType type, int value)",JAVADOC_MODIFICATION,METHOD_MODIFICATION,,Increase test coverage
sample_0053,JodaOrg/joda-time,9566157414404c5ea9b4003e4c3bdf334abcd67f,JodaTime/src/java/org/joda/time/DateMidnight.java,method,DateMidnight,public DateMidnight(Object instant),JAVADOC_MODIFICATION,METHOD_MODIFICATION,,Rework InstantConverter to reduce number of methods
sample_0054,JodaOrg/joda-time,9566157414404c5ea9b4003e4c3bdf334abcd67f,JodaTime/src/java/org/joda/time/DateTime.java,method,DateTime,public DateTime(Object instant),JAVADOC_MODIFICATION,METHOD_MODIFICATION,,Rework InstantConverter to reduce number of methods
sample_0055,JodaOrg/joda-time,9566157414404c5ea9b4003e4c3bdf334abcd67f,JodaTime/src/java/org/joda/time/MutableDateTime.java,method,MutableDateTime,public MutableDateTime(Object instant),JAVADOC_MODIFICATION,METHOD_MODIFICATION,,Rework InstantConverter to reduce number of methods
sample_0056,JodaOrg/joda-time,d7ca0e33ec72b0e4557bdd9c31bb3142765a28ee,JodaTime/src/java/org/joda/time/convert/ConverterManager.java,class,ConverterManager,public final class ConverterManager,JAVADOC_MODIFICATION,METHOD_MODIFICATION,,Add PartialConverter
sample_0057,JodaOrg/joda-time,cee767aab23b93768812f1027664ff3d83edd7e8,JodaTime/src/java/org/joda/time/base/AbstractInstant.java,method,getZone,public DateTimeZone getZone(),JAVADOC_MODIFICATION,METHOD_MODIFICATION,,Refine API and increase test coverage
sample_0058,JodaOrg/joda-time,8ef60672c1dd5407b0761b81408857be44562ecf,JodaTime/src/java/org/joda/time/Instant.java,class,Instant,"public final class Instant extends AbstractInstant implements ReadableInstant, Serializable",JAVADOC_MODIFICATION,METHOD_MODIFICATION,,Update API Instant now ISO UTC withXxx methods added to lots of classes uniform set of methods almost complete
sample_0059,JodaOrg/joda-time,8ef60672c1dd5407b0761b81408857be44562ecf,JodaTime/src/java/org/joda/time/Instant.java,method,getChronology,public Chronology getChronology(),JAVADOC_MODIFICATION,METHOD_MODIFICATION,,Update API Instant now ISO UTC withXxx methods added to lots of classes uniform set of methods almost complete
sample_0060,JodaOrg/joda-time,14ca195dfadb4b2f2c71eae03b2d58d165c033f9,JodaTime/src/java/org/joda/time/MutablePeriod.java,method,setPeriod,public void setPeriod(ReadableInterval interval),JAVADOC_MODIFICATION,METHOD_MODIFICATION,,Move code from BasePeriod to chrono
sample_0061,JodaOrg/joda-time,750176f51260af36de4802e8150862431e9108bf,JodaTime/src/java/org/joda/time/Period.java,class,Period,"public final class Period extends BasePeriod implements ReadablePeriod, Serializable",JAVADOC_MODIFICATION,METHOD_MODIFICATION,,More Period methods and tests
sample_0062,JodaOrg/joda-time,233ac67186840969dadbc86b371ad15c673ed0ca,JodaTime/src/java/org/joda/time/Interval.java,method,Interval,public Interval(Object interval),JAVADOC_MODIFICATION,METHOD_MODIFICATION,,Add chronology to interval
sample_0063,JodaOrg/joda-time,233ac67186840969dadbc86b371ad15c673ed0ca,JodaTime/src/java/org/joda/time/MutableInterval.java,method,MutableInterval,public MutableInterval(Object interval),JAVADOC_MODIFICATION,METHOD_MODIFICATION,,Add chronology to interval
sample_0064,JodaOrg/joda-time,233ac67186840969dadbc86b371ad15c673ed0ca,JodaTime/src/java/org/joda/time/MutableInterval.java,method,setInterval,"public void setInterval(ReadableInstant start, ReadableInstant end)",JAVADOC_MODIFICATION,METHOD_MODIFICATION,,Add chronology to interval
sample_0065,JodaOrg/joda-time,06145d41ac9b5cd8e11fd6553f44cf613633f263,JodaTime/src/java/org/joda/time/field/AbstractReadableInstantFieldProperty.java,method,compareTo,public int compareTo(ReadableInstant instant),JAVADOC_MODIFICATION,METHOD_MODIFICATION,,Add a compare to method
sample_0066,JodaOrg/joda-time,89be5d7dd4355ae9d3e841a2b97b59a001c8e85d,JodaTime/src/java/org/joda/time/base/AbstractInterval.java,method,contains,public boolean contains(ReadableInterval interval),JAVADOC_MODIFICATION,METHOD_MODIFICATION,,Add functionality to intervals
sample_0067,JodaOrg/joda-time,89be5d7dd4355ae9d3e841a2b97b59a001c8e85d,JodaTime/src/java/org/joda/time/base/AbstractInterval.java,method,overlaps,public boolean overlaps(ReadableInterval interval),JAVADOC_MODIFICATION,METHOD_MODIFICATION,,Add functionality to intervals
sample_0068,JodaOrg/joda-time,24481f10ccfe00f1e0e1566c63db861e33085862,JodaTime/src/java/org/joda/time/field/AbstractPartialFieldProperty.java,method,compareTo,public int compareTo(ReadableInstant instant),JAVADOC_MODIFICATION,METHOD_MODIFICATION,,Use DateTimeFieldType in ReadablePartial
sample_0069,JodaOrg/joda-time,4f040633aa15a3b12bb014257b04ef8e8a9c0ede,JodaTime/src/java/org/joda/time/Chronology.java,class,Chronology,public abstract class Chronology,JAVADOC_MODIFICATION,METHOD_MODIFICATION,,Add factory methods
sample_0070,JodaOrg/joda-time,5fd28fcd3425461dfcff1800753513f94807f652,JodaTime/src/java/org/joda/time/format/PeriodFormatterBuilder.java,method,toFormatter,public PeriodFormatter toFormatter(),JAVADOC_MODIFICATION,METHOD_MODIFICATION,,Fix and simplify zero handling in period format
sample_0071,JodaOrg/joda-time,41bfd0a024869ee41a444ceece4581c11308cc2f,JodaTime/src/java/org/joda/time/format/PeriodFormatterBuilder.java,method,getFieldValue,long getFieldValue(ReadablePeriod period),JAVADOC_MODIFICATION,METHOD_MODIFICATION,,Add ability to display milliseconds as decimal places of seconds
sample_0072,JodaOrg/joda-time,c2eb7b74ad0089ae97c4197ebf4079c03f4c9cfd,JodaTime/src/java/org/joda/time/format/PeriodFormatterBuilder.java,method,appendSeparator,"public PeriodFormatterBuilder appendSeparator(String text, String finalText)",JAVADOC_MODIFICATION,METHOD_MODIFICATION,,Add new separator functionality to meet ISO8601 requirements
sample_0073,JodaOrg/joda-time,5f9b9b675631bda3568df0d47ca305126d426011,JodaTime/src/java/org/joda/time/base/AbstractPartial.java,class,AbstractPartial,public abstract class AbstractPartial implements ReadablePartial,JAVADOC_MODIFICATION,METHOD_MODIFICATION,,Create BasePartial
sample_0074,JodaOrg/joda-time,6f9b67a4e3817169516d24939a2aa5242ce65d49,JodaTime/src/java/org/joda/time/ReadablePeriod.java,method,addTo,"DateTime addTo(ReadableInstant instant, int scalar)",JAVADOC_MODIFICATION,METHOD_MODIFICATION,,Return DateTime not Instant from add as period is date based
sample_0075,JodaOrg/joda-time,8fe006070aebd84b6cd2b8870e1095c932a36248,JodaTime/src/java/org/joda/time/base/AbstractDuration.java,method,toDuration,public Duration toDuration(),JAVADOC_MODIFICATION,METHOD_MODIFICATION,,Optimise toXxx() methods
sample_0076,JodaOrg/joda-time,8fe006070aebd84b6cd2b8870e1095c932a36248,JodaTime/src/java/org/joda/time/base/AbstractInterval.java,method,toInterval,public Interval toInterval(),JAVADOC_MODIFICATION,METHOD_MODIFICATION,,Optimise toXxx() methods
sample_0077,JodaOrg/joda-time,5f2aa4794e8094eb6b3018589c3a751f61bd2fa6,JodaTime/src/java/org/joda/time/MutablePeriod.java,method,add,public void add(ReadableInterval interval),JAVADOC_MODIFICATION,METHOD_MODIFICATION,,Create BasePeriod
sample_0078,JodaOrg/joda-time,fa310b0723a1c0ded3328bcf150d242ab6cc2e34,JodaTime/src/java/org/joda/time/base/AbstractInstant.java,method,isAfter,public boolean isAfter(ReadableInstant instant),JAVADOC_MODIFICATION,METHOD_MODIFICATION,,Add isXxx() methods Optimise by using DateTimeUtils
sample_0079,JodaOrg/joda-time,fa310b0723a1c0ded3328bcf150d242ab6cc2e34,JodaTime/src/java/org/joda/time/base/AbstractInstant.java,method,isBefore,public boolean isBefore(ReadableInstant instant),JAVADOC_MODIFICATION,METHOD_MODIFICATION,,Add isXxx() methods Optimise by using DateTimeUtils
sample_0080,JodaOrg/joda-time,fa310b0723a1c0ded3328bcf150d242ab6cc2e34,JodaTime/src/java/org/joda/time/base/AbstractInstant.java,method,isEqual,public boolean isEqual(ReadableInstant instant),JAVADOC_MODIFICATION,METHOD_MODIFICATION,,Add isXxx() methods Optimise by using DateTimeUtils
sample_0081,JodaOrg/joda-time,7eadd1a45e96f15594dcf734cb9af26e2af508fa,JodaTime/src/java/org/joda/time/DateTimeUtils.java,method,getInstantChronology,public static final Chronology getInstantChronology(ReadableInstant instant),JAVADOC_MODIFICATION,METHOD_MODIFICATION,,Select DateTimeUtils methods to keep
sample_0082,JodaOrg/joda-time,95693de1e0a55957a4318de55d76a67258f0f0aa,JodaTime/src/java/org/joda/time/Interval.java,class,Interval,"public class Interval extends AbstractInterval implements ReadableInterval, Serializable",JAVADOC_MODIFICATION,METHOD_MODIFICATION,,Detail of Interval implementation derived from testing
sample_0083,JodaOrg/joda-time,24e79cfd1b603f32ea78a132762ee03b77ed934f,JodaTime/src/java/org/joda/time/convert/ConverterManager.java,class,ConverterManager,public final class ConverterManager,JAVADOC_MODIFICATION,METHOD_MODIFICATION,,Split Duration and TimePeriod converters and Javadoc
sample_0084,JodaOrg/joda-time,24e79cfd1b603f32ea78a132762ee03b77ed934f,JodaTime/src/java/org/joda/time/convert/StringConverter.java,method,getDurationMillis,public long getDurationMillis(Object object),JAVADOC_MODIFICATION,METHOD_MODIFICATION,,Split Duration and TimePeriod converters and Javadoc
sample_0085,JodaOrg/joda-time,fecb52131ddbfef462a71375fa1124f83c030668,JodaTime/src/java/org/joda/time/AbstractInterval.java,method,AbstractInterval,"public AbstractInterval(ReadableInstant start, ReadableInstant end)",JAVADOC_MODIFICATION,METHOD_MODIFICATION,,"Remove null restrictions, javadoc and tidy prior to testing"
sample_0086,JodaOrg/joda-time,fecb52131ddbfef462a71375fa1124f83c030668,JodaTime/src/java/org/joda/time/AbstractInterval.java,method,getDuration,public final Duration getDuration(DurationType type),JAVADOC_MODIFICATION,METHOD_MODIFICATION,,"Remove null restrictions, javadoc and tidy prior to testing"
